{
  "$schema": "./browser.lock.schema.json",
  "lockfile_version": 1,

  "chromium": {
    "version": "146.0.7680.177",
    "commit": "ae03f7fb2cf1215853896d6a4c15fdceee2badb7",
    "url": "https://chromium.googlesource.com/chromium/src.git",
    "ref": "refs/tags/146.0.7680.177"
  },

  "depot_tools": {
    "commit": "41c40cfaec7ee3bf0423c59925d8b23982a601f1",
    "url": "https://chromium.googlesource.com/chromium/tools/depot_tools.git",
    "note": "Pinned because depot_tools resolves every other revision. tools/sync-sources.sh checks this out detached before anything invokes gclient, gn or autoninja."
  },

  "ungoogled_chromium": {
    "version": "146.0.7680.177-1",
    "commit": "ecd0ec03e0d8b1ec59d3b32f3145575ada937490",
    "url": "https://github.com/ungoogled-software/ungoogled-chromium.git",
    "ref": "refs/tags/146.0.7680.177-1",
    "legacy": true,
    "removal_issue": 8
  },

  "third_party": {
    "adblock_rust": {
      "pinned": false,
      "reason": "tools/vendor-adblock-rust.sh does not select a revision: it appends an 'adblock' dependency at a caret range to Chromium's third_party/rust/chromium_crates_io/Cargo.toml and lets gnrt resolve it, so there is no revision to record. Pinning it means changing how vendoring works, which affects browser output and belongs to its own change rather than to the lock.",
      "issue": 5
    }
  }
}
